RESULTADOS - PROBLEMA DE DIVERSIDADE MAXIMA
Ficheiro: tourism_250.txt
C=250, m=50
Execucoes: 10
Seed: 1765131592
=====================================

=== HILL CLIMBING ===

Vizinhanca 1, Iteracoes 500
  Run 1: 1765.8790
  Run 2: 1765.3596
  Run 3: 1737.3045
  Run 4: 1771.1082
  Run 5: 1758.0178
  Run 6: 1733.7642
  Run 7: 1767.6118
  Run 8: 1767.0632
  Run 9: 1769.8345
  Run 10: 1752.3154
  Melhor: 1771.1082, Pior: 1733.7642, Media: 1758.8258, Desvio: 12.8212

Vizinhanca 1, Iteracoes 1000
  Run 1: 1773.2700
  Run 2: 1787.5263
  Run 3: 1786.2819
  Run 4: 1786.2470
  Run 5: 1788.2483
  Run 6: 1792.0907
  Run 7: 1793.0364
  Run 8: 1778.6054
  Run 9: 1795.0112
  Run 10: 1793.9925
  Melhor: 1795.0112, Pior: 1773.2700, Media: 1787.4310, Desvio: 6.5990

Vizinhanca 1, Iteracoes 2000
  Run 1: 1802.7026
  Run 2: 1793.2666
  Run 3: 1800.8140
  Run 4: 1797.4857
  Run 5: 1792.3995
  Run 6: 1798.3437
  Run 7: 1796.7124
  Run 8: 1797.3447
  Run 9: 1794.9747
  Run 10: 1800.0116
  Melhor: 1802.7026, Pior: 1792.3995, Media: 1797.4055, Desvio: 3.0974

Vizinhanca 2, Iteracoes 500
  Run 1: 1743.4697
  Run 2: 1713.6175
  Run 3: 1709.0989
  Run 4: 1703.7481
  Run 5: 1708.4791
  Run 6: 1707.3965
  Run 7: 1714.0382
  Run 8: 1715.7582
  Run 9: 1740.0151
  Run 10: 1722.0163
  Melhor: 1743.4697, Pior: 1703.7481, Media: 1717.7638, Desvio: 12.9395

Vizinhanca 2, Iteracoes 1000
  Run 1: 1764.7756
  Run 2: 1756.3931
  Run 3: 1741.9292
  Run 4: 1744.0029
  Run 5: 1755.8889
  Run 6: 1755.3604
  Run 7: 1754.9106
  Run 8: 1722.8965
  Run 9: 1741.6087
  Run 10: 1757.8249
  Melhor: 1764.7756, Pior: 1722.8965, Media: 1749.5591, Desvio: 11.4548

Vizinhanca 2, Iteracoes 2000
  Run 1: 1764.0815
  Run 2: 1762.2124
  Run 3: 1777.6125
  Run 4: 1770.2721
  Run 5: 1771.2157
  Run 6: 1770.1308
  Run 7: 1768.2801
  Run 8: 1771.5485
  Run 9: 1766.6777
  Run 10: 1780.0893
  Melhor: 1780.0893, Pior: 1762.2124, Media: 1770.2121, Desvio: 5.2243


=== EVOLUTIVO ===

--- Variando Populacao ---

Populacao: 30, Geracoes: 100
  Run 1: 1761.4439
  Run 2: 1782.7261
  Run 3: 1784.4475
  Run 4: 1791.0533
  Run 5: 1793.8774
  Run 6: 1769.6078
  Run 7: 1782.1848
  Run 8: 1778.3380
  Run 9: 1774.0406
  Run 10: 1779.5029
  Melhor: 1793.8774, Pior: 1761.4439, Media: 1779.7222, Desvio: 9.1478

Populacao: 50, Geracoes: 100
  Run 1: 1799.9955
  Run 2: 1801.2263
  Run 3: 1794.1331
  Run 4: 1793.1182
  Run 5: 1791.1657
  Run 6: 1794.5384
  Run 7: 1794.3507
  Run 8: 1800.6020
  Run 9: 1797.4127
  Run 10: 1796.7782
  Melhor: 1801.2263, Pior: 1791.1657, Media: 1796.3321, Desvio: 3.2553

Populacao: 100, Geracoes: 100
  Run 1: 1802.3413
  Run 2: 1803.0500
  Run 3: 1802.7005
  Run 4: 1803.0934
  Run 5: 1805.2829
  Run 6: 1804.7624
  Run 7: 1802.1219
  Run 8: 1803.1129
  Run 9: 1801.7846
  Run 10: 1804.2851
  Melhor: 1805.2829, Pior: 1801.7846, Media: 1803.2535, Desvio: 1.1010

--- Variando Probabilidades ---

Crossover: 0.70, Mutacao: 0.05
  Run 1: 1796.2385
  Run 2: 1768.2882
  Run 3: 1781.9691
  Run 4: 1780.3164
  Run 5: 1789.1635
  Run 6: 1788.0868
  Run 7: 1793.6065
  Run 8: 1788.9682
  Run 9: 1791.3649
  Run 10: 1787.5028
  Melhor: 1796.2385, Pior: 1768.2882, Media: 1786.5505, Desvio: 7.5903

Crossover: 0.70, Mutacao: 0.10
  Run 1: 1781.6560
  Run 2: 1797.7917
  Run 3: 1788.4411
  Run 4: 1793.8238
  Run 5: 1791.3829
  Run 6: 1792.8622
  Run 7: 1798.7700
  Run 8: 1796.2648
  Run 9: 1796.0047
  Run 10: 1787.8063
  Melhor: 1798.7700, Pior: 1781.6560, Media: 1792.4804, Desvio: 5.0299

Crossover: 0.70, Mutacao: 0.20
  Run 1: 1793.7682
  Run 2: 1793.6581
  Run 3: 1801.1992
  Run 4: 1785.7324
  Run 5: 1793.1735
  Run 6: 1793.6974
  Run 7: 1797.8281
  Run 8: 1798.1355
  Run 9: 1801.2693
  Run 10: 1795.2053
  Melhor: 1801.2693, Pior: 1785.7324, Media: 1795.3667, Desvio: 4.3417

Crossover: 0.80, Mutacao: 0.05
  Run 1: 1795.2229
  Run 2: 1785.5218
  Run 3: 1796.1545
  Run 4: 1797.5530
  Run 5: 1798.4684
  Run 6: 1790.3917
  Run 7: 1791.2451
  Run 8: 1792.0359
  Run 9: 1796.1703
  Run 10: 1797.2405
  Melhor: 1798.4684, Pior: 1785.5218, Media: 1794.0004, Desvio: 3.8767

Crossover: 0.80, Mutacao: 0.10
  Run 1: 1794.1171
  Run 2: 1794.0445
  Run 3: 1782.2851
  Run 4: 1791.5517
  Run 5: 1789.0083
  Run 6: 1798.0759
  Run 7: 1791.3684
  Run 8: 1798.4406
  Run 9: 1799.7820
  Run 10: 1799.4396
  Melhor: 1799.7820, Pior: 1782.2851, Media: 1793.8113, Desvio: 5.2353

Crossover: 0.80, Mutacao: 0.20
  Run 1: 1803.4940
  Run 2: 1803.3109
  Run 3: 1801.9618
  Run 4: 1796.2555
  Run 5: 1792.7002
  Run 6: 1789.6852
  Run 7: 1798.4622
  Run 8: 1795.7272
  Run 9: 1796.7913
  Run 10: 1802.1069
  Melhor: 1803.4940, Pior: 1789.6852, Media: 1798.0495, Desvio: 4.4501

Crossover: 0.90, Mutacao: 0.05
  Run 1: 1796.1532
  Run 2: 1799.4546
  Run 3: 1790.5762
  Run 4: 1802.4915
  Run 5: 1795.3336
  Run 6: 1797.2052
  Run 7: 1797.1469
  Run 8: 1794.2644
  Run 9: 1801.1807
  Run 10: 1795.6982
  Melhor: 1802.4915, Pior: 1790.5762, Media: 1796.9505, Desvio: 3.2808

Crossover: 0.90, Mutacao: 0.10
  Run 1: 1796.7512
  Run 2: 1796.2759
  Run 3: 1797.2478
  Run 4: 1799.0384
  Run 5: 1802.7097
  Run 6: 1797.7728
  Run 7: 1798.1065
  Run 8: 1789.8546
  Run 9: 1793.1923
  Run 10: 1799.7930
  Melhor: 1802.7097, Pior: 1789.8546, Media: 1797.0742, Desvio: 3.3545

Crossover: 0.90, Mutacao: 0.20
  Run 1: 1798.6130
  Run 2: 1800.1623
  Run 3: 1802.5883
  Run 4: 1798.7780
  Run 5: 1799.4677
  Run 6: 1796.8326
  Run 7: 1803.6930
  Run 8: 1800.0430
  Run 9: 1803.4344
  Run 10: 1795.5294
  Melhor: 1803.6930, Pior: 1795.5294, Media: 1799.9142, Desvio: 2.5653

--- Comparando Selecoes ---

Selecao: Torneio
  Run 1: 1796.9599
  Run 2: 1795.7915
  Run 3: 1790.6934
  Run 4: 1796.5003
  Run 5: 1796.2091
  Run 6: 1797.2569
  Run 7: 1790.9551
  Run 8: 1801.6949
  Run 9: 1795.2285
  Run 10: 1789.8144
  Melhor: 1801.6949, Pior: 1789.8144, Media: 1795.1104, Desvio: 3.4616

Selecao: Roleta
  Run 1: 1776.8377
  Run 2: 1791.0799
  Run 3: 1761.1447
  Run 4: 1786.8400
  Run 5: 1779.2302
  Run 6: 1776.7095
  Run 7: 1786.8578
  Run 8: 1776.7760
  Run 9: 1755.4112
  Run 10: 1775.5997
  Melhor: 1791.0799, Pior: 1755.4112, Media: 1776.6487, Desvio: 10.5621

--- Comparando Crossovers ---

Crossover: Uniforme
  Run 1: 1799.8833
  Run 2: 1802.0157
  Run 3: 1802.0316
  Run 4: 1800.3981
  Run 5: 1801.4398
  Run 6: 1795.1395
  Run 7: 1799.2739
  Run 8: 1788.4702
  Run 9: 1800.1813
  Run 10: 1795.4702
  Melhor: 1802.0316, Pior: 1788.4702, Media: 1798.4304, Desvio: 4.0427

Crossover: UmPonto
  Run 1: 1791.3689
  Run 2: 1755.9024
  Run 3: 1759.7754
  Run 4: 1767.9919
  Run 5: 1779.8773
  Run 6: 1769.2589
  Run 7: 1788.7822
  Run 8: 1777.1735
  Run 9: 1765.8965
  Run 10: 1779.2953
  Melhor: 1791.3689, Pior: 1755.9024, Media: 1773.5322, Desvio: 11.1569


=== HIBRIDOS ===

--- Hibrido 1 ---
  Run 1: 1794.5889
  Run 2: 1799.9230
  Run 3: 1795.3694
  Run 4: 1793.0483
  Run 5: 1799.6150
  Run 6: 1800.2915
  Run 7: 1793.6390
  Run 8: 1797.6593
  Run 9: 1802.8348
  Run 10: 1791.8793
  Melhor: 1802.8348, Pior: 1791.8793, Media: 1796.8849, Desvio: 3.4953

--- Hibrido 2 ---
  Run 1: 1742.5600
  Run 2: 1750.0625
  Run 3: 1746.5695
  Run 4: 1742.6943
  Run 5: 1758.0270
  Run 6: 1750.9751
  Run 7: 1753.7280
  Run 8: 1744.2843
  Run 9: 1755.8295
  Run 10: 1758.8892
  Melhor: 1758.8892, Pior: 1742.5600, Media: 1750.3619, Desvio: 5.8664

--- Hibrido 3 ---
  Run 1: 1804.4147
  Run 2: 1804.4069
  Run 3: 1803.9817
  Run 4: 1805.2087
  Run 5: 1802.9934
  Run 6: 1805.2829
  Run 7: 1804.3368
  Run 8: 1804.4106
  Run 9: 1805.1119
  Run 10: 1804.8464
  Melhor: 1805.2829, Pior: 1802.9934, Media: 1804.4994, Desvio: 0.6480


=====================================
    COMPARACAO FINAL DOS ALGORITMOS
=====================================

Algoritmo            |     Melhor |       Pior |      Media |     Desvio
-----+------------+------------+------------+------------+
Melhor HC            |  1802.7026 |  1792.3995 |  1797.4055 |     3.0974
Melhor EA            |  1805.2829 |  1801.7846 |  1803.2535 |     1.1010
Hibrido 1            |  1802.8348 |  1791.8793 |  1796.8849 |     3.4953
Hibrido 2            |  1758.8892 |  1742.5600 |  1750.3619 |     5.8664


MELHOR ALGORITMO: Melhor EA (Media: 1803.2535)
