RESULTADOS - PROBLEMA DE DIVERSIDADE MAXIMA
Ficheiro: tourism_50.txt
C=50, m=15
Execucoes: 10
Seed: 1765137740
=====================================

=== HILL CLIMBING ===

Vizinhanca 1, Iteracoes 500
  Run 1: 498.7146
  Run 2: 497.5715
  Run 3: 498.3343
  Run 4: 497.2957
  Run 5: 499.5381
  Run 6: 499.2953
  Run 7: 498.7146
  Run 8: 498.7146
  Run 9: 499.2953
  Run 10: 491.5573
  Melhor: 499.5381, Pior: 491.5573, Media: 497.9031, Desvio: 2.2239

Vizinhanca 1, Iteracoes 1000
  Run 1: 498.7146
  Run 2: 499.5381
  Run 3: 498.1275
  Run 4: 499.5381
  Run 5: 499.5381
  Run 6: 498.1275
  Run 7: 498.7146
  Run 8: 499.5381
  Run 9: 498.1275
  Run 10: 499.5381
  Melhor: 499.5381, Pior: 498.1275, Media: 498.9502, Desvio: 0.6221

Vizinhanca 1, Iteracoes 2000
  Run 1: 499.5381
  Run 2: 499.5381
  Run 3: 499.5381
  Run 4: 499.5381
  Run 5: 499.5381
  Run 6: 499.5381
  Run 7: 499.5381
  Run 8: 499.5381
  Run 9: 499.5381
  Run 10: 499.5381
  Melhor: 499.5381, Pior: 499.5381, Media: 499.5381, Desvio: 0.0000

Vizinhanca 2, Iteracoes 500
  Run 1: 497.2989
  Run 2: 493.3785
  Run 3: 481.2473
  Run 4: 489.7999
  Run 5: 481.2998
  Run 6: 489.9503
  Run 7: 488.9373
  Run 8: 483.3149
  Run 9: 490.8842
  Run 10: 496.6370
  Melhor: 497.2989, Pior: 481.2473, Media: 489.2748, Desvio: 5.4993

Vizinhanca 2, Iteracoes 1000
  Run 1: 498.0004
  Run 2: 498.3343
  Run 3: 493.0855
  Run 4: 487.4696
  Run 5: 495.0106
  Run 6: 491.5315
  Run 7: 498.1275
  Run 8: 498.4144
  Run 9: 493.7742
  Run 10: 493.0018
  Melhor: 498.4144, Pior: 487.4696, Media: 494.6750, Desvio: 3.4409

Vizinhanca 2, Iteracoes 2000
  Run 1: 498.0306
  Run 2: 495.5549
  Run 3: 499.5381
  Run 4: 497.5699
  Run 5: 495.3557
  Run 6: 495.0106
  Run 7: 499.5381
  Run 8: 497.8809
  Run 9: 496.1464
  Run 10: 497.2989
  Melhor: 499.5381, Pior: 495.0106, Media: 497.1924, Desvio: 1.5571


=== EVOLUTIVO ===

--- Variando Populacao ---

Populacao: 30, Geracoes: 100
  Run 1: 496.1586
  Run 2: 499.5381
  Run 3: 499.5381
  Run 4: 496.9294
  Run 5: 498.7146
  Run 6: 499.5381
  Run 7: 495.7756
  Run 8: 491.5956
  Run 9: 498.4144
  Run 10: 497.5470
  Melhor: 499.5381, Pior: 491.5956, Media: 497.3749, Desvio: 2.3362

Populacao: 50, Geracoes: 100
  Run 1: 499.5381
  Run 2: 499.5381
  Run 3: 499.5381
  Run 4: 499.5381
  Run 5: 499.5381
  Run 6: 498.1275
  Run 7: 496.7790
  Run 8: 498.1275
  Run 9: 499.5381
  Run 10: 498.3830
  Melhor: 499.5381, Pior: 496.7790, Media: 498.8646, Desvio: 0.9160

Populacao: 100, Geracoes: 100
  Run 1: 499.5381
  Run 2: 499.5381
  Run 3: 499.5381
  Run 4: 499.5381
  Run 5: 499.5381
  Run 6: 499.5381
  Run 7: 499.2953
  Run 8: 499.5381
  Run 9: 499.5381
  Run 10: 499.5381
  Melhor: 499.5381, Pior: 499.2953, Media: 499.5138, Desvio: 0.0728

--- Variando Probabilidades ---

Crossover: 0.70, Mutacao: 0.05
  Run 1: 499.5381
  Run 2: 498.3830
  Run 3: 497.6478
  Run 4: 499.5381
  Run 5: 499.5381
  Run 6: 498.3343
  Run 7: 499.2953
  Run 8: 497.0579
  Run 9: 499.2953
  Run 10: 499.5381
  Melhor: 499.5381, Pior: 497.0579, Media: 498.8166, Desvio: 0.8614

Crossover: 0.70, Mutacao: 0.10
  Run 1: 499.5381
  Run 2: 499.5381
  Run 3: 499.2953
  Run 4: 499.5381
  Run 5: 496.7790
  Run 6: 499.5381
  Run 7: 498.3343
  Run 8: 498.1275
  Run 9: 499.2953
  Run 10: 498.1275
  Melhor: 499.5381, Pior: 496.7790, Media: 498.8111, Desvio: 0.8874

Crossover: 0.70, Mutacao: 0.20
  Run 1: 498.3343
  Run 2: 499.5381
  Run 3: 498.7146
  Run 4: 499.5381
  Run 5: 499.5381
  Run 6: 499.5381
  Run 7: 498.0306
  Run 8: 499.5381
  Run 9: 499.5381
  Run 10: 498.1275
  Melhor: 499.5381, Pior: 498.0306, Media: 499.0436, Desvio: 0.6280

Crossover: 0.80, Mutacao: 0.05
  Run 1: 499.5381
  Run 2: 498.1275
  Run 3: 499.5381
  Run 4: 498.3343
  Run 5: 498.3830
  Run 6: 499.5381
  Run 7: 499.5381
  Run 8: 496.8445
  Run 9: 499.5381
  Run 10: 496.8604
  Melhor: 499.5381, Pior: 496.8445, Media: 498.6240, Desvio: 1.0413

Crossover: 0.80, Mutacao: 0.10
  Run 1: 498.7146
  Run 2: 499.5381
  Run 3: 499.5381
  Run 4: 498.3830
  Run 5: 499.5381
  Run 6: 499.5381
  Run 7: 499.5381
  Run 8: 499.5381
  Run 9: 499.5381
  Run 10: 498.7146
  Melhor: 499.5381, Pior: 498.3830, Media: 499.2579, Desvio: 0.4365

Crossover: 0.80, Mutacao: 0.20
  Run 1: 499.2953
  Run 2: 498.1275
  Run 3: 499.5381
  Run 4: 499.5381
  Run 5: 499.5381
  Run 6: 498.3343
  Run 7: 499.5381
  Run 8: 498.7146
  Run 9: 499.5381
  Run 10: 498.3830
  Melhor: 499.5381, Pior: 498.1275, Media: 499.0545, Desvio: 0.5632

Crossover: 0.90, Mutacao: 0.05
  Run 1: 493.3691
  Run 2: 499.2953
  Run 3: 499.5381
  Run 4: 499.5381
  Run 5: 499.5381
  Run 6: 499.5381
  Run 7: 499.5381
  Run 8: 499.5381
  Run 9: 497.8513
  Run 10: 499.5381
  Melhor: 499.5381, Pior: 493.3691, Media: 498.7282, Desvio: 1.8548

Crossover: 0.90, Mutacao: 0.10
  Run 1: 499.5381
  Run 2: 498.7146
  Run 3: 499.5381
  Run 4: 499.5381
  Run 5: 499.5381
  Run 6: 499.5381
  Run 7: 499.5381
  Run 8: 499.5381
  Run 9: 499.5381
  Run 10: 497.8513
  Melhor: 499.5381, Pior: 497.8513, Media: 499.2871, Desvio: 0.5379

Crossover: 0.90, Mutacao: 0.20
  Run 1: 499.5381
  Run 2: 499.5381
  Run 3: 499.5381
  Run 4: 499.5381
  Run 5: 499.5381
  Run 6: 499.5381
  Run 7: 499.5381
  Run 8: 499.5381
  Run 9: 499.5381
  Run 10: 498.7146
  Melhor: 499.5381, Pior: 498.7146, Media: 499.4557, Desvio: 0.2471

--- Comparando Selecoes ---

Selecao: Torneio
  Run 1: 496.7715
  Run 2: 499.5381
  Run 3: 499.5381
  Run 4: 497.6524
  Run 5: 499.5381
  Run 6: 497.0579
  Run 7: 497.4780
  Run 8: 499.5381
  Run 9: 498.7146
  Run 10: 499.5381
  Melhor: 499.5381, Pior: 496.7715, Media: 498.5365, Desvio: 1.1069

Selecao: Roleta
  Run 1: 498.7146
  Run 2: 499.5381
  Run 3: 499.5381
  Run 4: 499.5381
  Run 5: 499.5381
  Run 6: 499.5381
  Run 7: 499.5381
  Run 8: 493.9833
  Run 9: 499.5381
  Run 10: 499.5381
  Melhor: 499.5381, Pior: 493.9833, Media: 498.9003, Desvio: 1.6573

--- Comparando Crossovers ---

Crossover: Uniforme
  Run 1: 498.0004
  Run 2: 498.3830
  Run 3: 498.7146
  Run 4: 498.1275
  Run 5: 499.5381
  Run 6: 499.5381
  Run 7: 499.5381
  Run 8: 499.5381
  Run 9: 498.1275
  Run 10: 499.2953
  Melhor: 499.5381, Pior: 498.0004, Media: 498.8801, Desvio: 0.6392

Crossover: UmPonto
  Run 1: 499.5381
  Run 2: 499.5381
  Run 3: 498.1275
  Run 4: 495.8377
  Run 5: 497.0579
  Run 6: 495.9903
  Run 7: 494.5924
  Run 8: 499.5381
  Run 9: 498.7146
  Run 10: 499.5381
  Melhor: 499.5381, Pior: 494.5924, Media: 497.8473, Desvio: 1.7598


=== HIBRIDOS ===

--- Hibrido 1 ---
  Run 1: 499.5381
  Run 2: 499.2953
  Run 3: 499.5381
  Run 4: 498.0306
  Run 5: 499.5381
  Run 6: 499.5381
  Run 7: 499.5381
  Run 8: 499.5381
  Run 9: 498.0306
  Run 10: 499.5381
  Melhor: 499.5381, Pior: 498.0306, Media: 499.2123, Desvio: 0.5952

--- Hibrido 2 ---
  Run 1: 499.5381
  Run 2: 499.5381
  Run 3: 498.1275
  Run 4: 498.4144
  Run 5: 499.5381
  Run 6: 499.2953
  Run 7: 499.2953
  Run 8: 499.5381
  Run 9: 497.4287
  Run 10: 497.5470
  Melhor: 499.5381, Pior: 497.4287, Media: 498.8261, Desvio: 0.8194

--- Hibrido 3 ---
  Run 1: 499.5381
  Run 2: 499.5381
  Run 3: 499.5381
  Run 4: 499.5381
  Run 5: 499.5381
  Run 6: 499.5381
  Run 7: 499.5381
  Run 8: 499.5381
  Run 9: 499.5381
  Run 10: 499.5381
  Melhor: 499.5381, Pior: 499.5381, Media: 499.5381, Desvio: 0.0000


=====================================
    COMPARACAO FINAL DOS ALGORITMOS
=====================================

Algoritmo            |     Melhor |       Pior |      Media |     Desvio
-----+------------+------------+------------+------------+
Melhor HC            |   499.5381 |   499.5381 |   499.5381 |     0.0000
Melhor EA            |   499.5381 |   499.2953 |   499.5138 |     0.0728
Hibrido 1            |   499.5381 |   498.0306 |   499.2123 |     0.5952
Hibrido 2            |   499.5381 |   497.4287 |   498.8261 |     0.8194


MELHOR ALGORITMO: Melhor HC (Media: 499.5381)
