RESULTADOS - PROBLEMA DE DIVERSIDADE MAXIMA
Ficheiro: tourism_100.txt
C=100, m=20
Execucoes: 10
Seed: 1765137749
=====================================

=== HILL CLIMBING ===

Vizinhanca 1, Iteracoes 500
  Run 1: 689.1143
  Run 2: 687.1850
  Run 3: 691.7272
  Run 4: 681.2116
  Run 5: 686.6302
  Run 6: 686.5578
  Run 7: 689.7429
  Run 8: 687.4291
  Run 9: 689.9848
  Run 10: 685.2477
  Melhor: 691.7272, Pior: 681.2116, Media: 687.4831, Desvio: 2.7936

Vizinhanca 1, Iteracoes 1000
  Run 1: 689.5042
  Run 2: 688.9040
  Run 3: 689.5525
  Run 4: 689.3511
  Run 5: 691.0711
  Run 6: 688.0390
  Run 7: 689.8870
  Run 8: 692.0101
  Run 9: 688.7150
  Run 10: 690.2616
  Melhor: 692.0101, Pior: 688.0390, Media: 689.7296, Desvio: 1.1001

Vizinhanca 1, Iteracoes 2000
  Run 1: 692.0101
  Run 2: 691.3974
  Run 3: 692.0101
  Run 4: 691.8820
  Run 5: 690.8204
  Run 6: 691.8820
  Run 7: 690.7350
  Run 8: 690.5844
  Run 9: 690.2262
  Run 10: 691.7272
  Melhor: 692.0101, Pior: 690.2262, Media: 691.3275, Desvio: 0.6391

Vizinhanca 2, Iteracoes 500
  Run 1: 677.5184
  Run 2: 675.3195
  Run 3: 683.2549
  Run 4: 676.7270
  Run 5: 677.0401
  Run 6: 673.5954
  Run 7: 683.0205
  Run 8: 666.2801
  Run 9: 673.7821
  Run 10: 671.6248
  Melhor: 683.2549, Pior: 666.2801, Media: 675.8163, Desvio: 4.7988

Vizinhanca 2, Iteracoes 1000
  Run 1: 675.8154
  Run 2: 677.4684
  Run 3: 683.3592
  Run 4: 681.1583
  Run 5: 680.7365
  Run 6: 682.6153
  Run 7: 681.1802
  Run 8: 680.3362
  Run 9: 683.7493
  Run 10: 680.0491
  Melhor: 683.7493, Pior: 675.8154, Media: 680.6468, Desvio: 2.3518

Vizinhanca 2, Iteracoes 2000
  Run 1: 683.6745
  Run 2: 680.2690
  Run 3: 685.0573
  Run 4: 681.4331
  Run 5: 684.5348
  Run 6: 681.6507
  Run 7: 683.6650
  Run 8: 681.8952
  Run 9: 686.6797
  Run 10: 687.0181
  Melhor: 687.0181, Pior: 680.2690, Media: 683.5877, Desvio: 2.1604


=== EVOLUTIVO ===

--- Variando Populacao ---

Populacao: 30, Geracoes: 100
  Run 1: 680.9378
  Run 2: 683.3159
  Run 3: 684.0015
  Run 4: 688.3066
  Run 5: 679.3943
  Run 6: 685.6504
  Run 7: 685.6025
  Run 8: 686.1775
  Run 9: 689.7638
  Run 10: 688.1417
  Melhor: 689.7638, Pior: 679.3943, Media: 685.1292, Desvio: 3.1187

Populacao: 50, Geracoes: 100
  Run 1: 687.9870
  Run 2: 690.6857
  Run 3: 691.8820
  Run 4: 687.4480
  Run 5: 689.5795
  Run 6: 687.6644
  Run 7: 686.9687
  Run 8: 688.6441
  Run 9: 688.0782
  Run 10: 690.8204
  Melhor: 691.8820, Pior: 686.9687, Media: 688.9758, Desvio: 1.5847

Populacao: 100, Geracoes: 100
  Run 1: 690.5844
  Run 2: 691.9321
  Run 3: 691.8820
  Run 4: 691.5707
  Run 5: 691.8820
  Run 6: 689.4543
  Run 7: 692.0101
  Run 8: 691.9321
  Run 9: 691.1900
  Run 10: 690.8464
  Melhor: 692.0101, Pior: 689.4543, Media: 691.3284, Desvio: 0.7863

--- Variando Probabilidades ---

Crossover: 0.70, Mutacao: 0.05
  Run 1: 688.1563
  Run 2: 683.2541
  Run 3: 679.4184
  Run 4: 689.4101
  Run 5: 690.2118
  Run 6: 691.8820
  Run 7: 691.5853
  Run 8: 686.3593
  Run 9: 688.8689
  Run 10: 689.2912
  Melhor: 691.8820, Pior: 679.4184, Media: 687.8437, Desvio: 3.6860

Crossover: 0.70, Mutacao: 0.10
  Run 1: 687.6229
  Run 2: 688.9343
  Run 3: 684.5357
  Run 4: 689.0487
  Run 5: 690.4141
  Run 6: 686.3083
  Run 7: 689.6467
  Run 8: 690.6788
  Run 9: 690.4704
  Run 10: 688.4403
  Melhor: 690.6788, Pior: 684.5357, Media: 688.6100, Desvio: 1.8780

Crossover: 0.70, Mutacao: 0.20
  Run 1: 690.9840
  Run 2: 689.8581
  Run 3: 690.5528
  Run 4: 691.6478
  Run 5: 689.8197
  Run 6: 690.1843
  Run 7: 691.3974
  Run 8: 691.9321
  Run 9: 690.2787
  Run 10: 687.6807
  Melhor: 691.9321, Pior: 687.6807, Media: 690.4335, Desvio: 1.1549

Crossover: 0.80, Mutacao: 0.05
  Run 1: 690.4141
  Run 2: 689.3401
  Run 3: 687.0751
  Run 4: 690.9479
  Run 5: 685.0473
  Run 6: 691.0385
  Run 7: 689.9841
  Run 8: 688.1608
  Run 9: 689.3058
  Run 10: 685.3982
  Melhor: 691.0385, Pior: 685.0473, Media: 688.6712, Desvio: 2.0749

Crossover: 0.80, Mutacao: 0.10
  Run 1: 691.6845
  Run 2: 689.9396
  Run 3: 690.7832
  Run 4: 690.1527
  Run 5: 690.2254
  Run 6: 690.0136
  Run 7: 686.4068
  Run 8: 683.8898
  Run 9: 687.7664
  Run 10: 691.5853
  Melhor: 691.6845, Pior: 683.8898, Media: 689.2447, Desvio: 2.3574

Crossover: 0.80, Mutacao: 0.20
  Run 1: 688.5328
  Run 2: 686.3324
  Run 3: 692.0101
  Run 4: 689.3999
  Run 5: 690.2262
  Run 6: 690.1448
  Run 7: 690.0897
  Run 8: 690.2118
  Run 9: 688.6136
  Run 10: 688.8312
  Melhor: 692.0101, Pior: 686.3324, Media: 689.4393, Desvio: 1.4238

Crossover: 0.90, Mutacao: 0.05
  Run 1: 689.9114
  Run 2: 689.5675
  Run 3: 688.0592
  Run 4: 690.9929
  Run 5: 686.5313
  Run 6: 687.6019
  Run 7: 688.0320
  Run 8: 688.8375
  Run 9: 688.2303
  Run 10: 689.9631
  Melhor: 690.9929, Pior: 686.5313, Media: 688.7727, Desvio: 1.2659

Crossover: 0.90, Mutacao: 0.10
  Run 1: 690.8925
  Run 2: 688.2970
  Run 3: 686.8749
  Run 4: 691.7993
  Run 5: 688.7958
  Run 6: 688.8421
  Run 7: 689.4543
  Run 8: 689.2505
  Run 9: 691.2447
  Run 10: 690.3626
  Melhor: 691.7993, Pior: 686.8749, Media: 689.5814, Desvio: 1.4240

Crossover: 0.90, Mutacao: 0.20
  Run 1: 691.2698
  Run 2: 691.7993
  Run 3: 689.6671
  Run 4: 691.6845
  Run 5: 689.9120
  Run 6: 690.4099
  Run 7: 688.3928
  Run 8: 689.6038
  Run 9: 689.5839
  Run 10: 691.2698
  Melhor: 691.7993, Pior: 688.3928, Media: 690.3593, Desvio: 1.0587

--- Comparando Selecoes ---

Selecao: Torneio
  Run 1: 689.7779
  Run 2: 689.5499
  Run 3: 691.2452
  Run 4: 689.4101
  Run 5: 687.3951
  Run 6: 691.3974
  Run 7: 690.5754
  Run 8: 688.9161
  Run 9: 686.2465
  Run 10: 690.5212
  Melhor: 691.3974, Pior: 686.2465, Media: 689.5035, Desvio: 1.5585

Selecao: Roleta
  Run 1: 689.0793
  Run 2: 689.9254
  Run 3: 688.0656
  Run 4: 691.4356
  Run 5: 690.3988
  Run 6: 689.5960
  Run 7: 691.5106
  Run 8: 689.5392
  Run 9: 689.8885
  Run 10: 690.8487
  Melhor: 691.5106, Pior: 688.0656, Media: 690.0288, Desvio: 1.0098

--- Comparando Crossovers ---

Crossover: Uniforme
  Run 1: 689.7459
  Run 2: 690.6137
  Run 3: 688.7387
  Run 4: 688.0879
  Run 5: 689.1701
  Run 6: 689.4143
  Run 7: 691.1215
  Run 8: 686.4358
  Run 9: 689.1701
  Run 10: 690.8202
  Melhor: 691.1215, Pior: 686.4358, Media: 689.3318, Desvio: 1.3258

Crossover: UmPonto
  Run 1: 687.1420
  Run 2: 687.9150
  Run 3: 686.6933
  Run 4: 690.1752
  Run 5: 688.2903
  Run 6: 687.2264
  Run 7: 683.8202
  Run 8: 685.3553
  Run 9: 689.5392
  Run 10: 686.0951
  Melhor: 690.1752, Pior: 683.8202, Media: 687.2252, Desvio: 1.7979


=== HIBRIDOS ===

--- Hibrido 1 ---
  Run 1: 690.6075
  Run 2: 690.6078
  Run 3: 689.5661
  Run 4: 690.1689
  Run 5: 688.7391
  Run 6: 688.6948
  Run 7: 688.1172
  Run 8: 691.2095
  Run 9: 690.6972
  Run 10: 691.8820
  Melhor: 691.8820, Pior: 688.1172, Media: 690.0290, Desvio: 1.1522

--- Hibrido 2 ---
  Run 1: 688.6874
  Run 2: 684.7547
  Run 3: 687.5558
  Run 4: 688.5485
  Run 5: 688.5587
  Run 6: 688.7521
  Run 7: 688.8033
  Run 8: 686.1068
  Run 9: 687.7773
  Run 10: 686.4839
  Melhor: 688.8033, Pior: 684.7547, Media: 687.6028, Desvio: 1.3184

--- Hibrido 3 ---
  Run 1: 692.0101
  Run 2: 692.0101
  Run 3: 691.9321
  Run 4: 691.9321
  Run 5: 692.0101
  Run 6: 692.0101
  Run 7: 692.0101
  Run 8: 692.0101
  Run 9: 692.0101
  Run 10: 692.0101
  Melhor: 692.0101, Pior: 691.9321, Media: 691.9945, Desvio: 0.0312


=====================================
    COMPARACAO FINAL DOS ALGORITMOS
=====================================

Algoritmo            |     Melhor |       Pior |      Media |     Desvio
-----+------------+------------+------------+------------+
Melhor HC            |   692.0101 |   690.2262 |   691.3275 |     0.6391
Melhor EA            |   692.0101 |   689.4543 |   691.3284 |     0.7863
Hibrido 1            |   691.8820 |   688.1172 |   690.0290 |     1.1522
Hibrido 2            |   688.8033 |   684.7547 |   687.6028 |     1.3184


MELHOR ALGORITMO: Melhor EA (Media: 691.3284)
